{"$schema":"https://json-schema.org/draft/2020-12/schema","title":"Neyra Task Envelope","type":"object","additionalProperties":false,"required":["task_id","requested_by","objective","allowed_sources","allowed_operations","approval_required","expected_evidence","stop_conditions"],"properties":{"task_id":{"type":"string","minLength":1},"requested_by":{"type":"string","minLength":1},"objective":{"type":"string","minLength":1},"allowed_sources":{"type":"array","items":{"type":"string"}},"allowed_operations":{"type":"array","items":{"type":"string"}},"approval_required":{"type":"boolean"},"expected_evidence":{"type":"array","items":{"type":"string"}},"stop_conditions":{"type":"array","items":{"type":"string"}}}}