{"task_id":"demo-legal-001","requested_by":"demo-owner","objective":"Identify non-standard renewal terms in a synthetic service agreement.","allowed_sources":["demo/company-sandbox/synthetic-service-agreement.md"],"allowed_operations":["analyze-authorized-documents"],"approval_required":false,"expected_evidence":["clause references","source excerpts","limitations"],"stop_conditions":["source unavailable","jurisdiction unspecified"]}